{"canonicalization":"fkst-testing-package-manifest-canonical-json.v1","creation_metadata":{"build_id":"schema-release","created_at":"2026-09-01T00:00:00Z"},"dependencies":{"fkst_packages":{"commit":"cccccccccccccccccccccccccccccccccccccccc","id":"fkst-packages"},"fkst_substrate":{"commit":"dddddddddddddddddddddddddddddddddddddddd","id":"fkst-substrate"}},"entrypoints":[{"capabilities":["semantic-runner"],"contract_major":"testing-runner.v1","name":"testing-runner.run"}],"manifest_digest":"eeeeeeeeeeeeeeeeeeeeeeeeeeeeeeeeeeeeeeeeeeeeeeeeeeeeeeeeeeeeeeee","package_content_sha256":"bbbbbbbbbbbbbbbbbbbbbbbbbbbbbbbbbbbbbbbbbbbbbbbbbbbbbbbbbbbbbbbb","package_id":"testing-runner","package_version":"1.0.0","producer":{"name":"fkst-packages-testing","toolchain":"publication","version":"1.0.0"},"runtime_requirements":{"lua":"5.4.0","platforms":["linux-amd64"]},"schema":"testing-package-manifest.v1","semantic_capabilities":["semantic-runner"],"source_commit":"aaaaaaaaaaaaaaaaaaaaaaaaaaaaaaaaaaaaaaaa","supported_contracts":{"canonicalization_profiles":["fkst-testing-package-manifest-canonical-json.v1"],"majors":["testing-runner.v1"]}}
